id,title,category,width_cm,depth_cm,height_cm,price_gbp,currency,store_name,source_url,description
1,Modern 3-Seater Sofa,Sofa,200,90,85,499.99,GBP,Made.com,,Comfortable fabric sofa with clean lines.
2,Oak Coffee Table,Coffee Table,120,60,45,150,GBP,Habitat,,Solid oak coffee table with natural finish.
3,Bookshelf with Drawers,Bookshelf,80,30,180,220,GBP,John Lewis,,Tall bookshelf with two drawers at the base.
4,Extendable Dining Table,Dining Table,160,90,75,650,GBP,IKEA London,,Wooden dining table extendable to accommodate six seats.
5,Ergonomic Office Chair,Chair,65,65,110,199,GBP,Wayfair UK,,Adjustable office chair with lumbar support.
6,Queen Size Bed Frame,Bed,160,200,100,399,GBP,Argos,,Metal bed frame with headboard and footboard.
